{
  "meta": {
    "slug": "trail-20k-740-13s",
    "title": "Trail 20 km / 740 m D+ — 13 semaines",
    "discipline": "hybride",
    "objective": {
      "distance_km": 20,
      "dplus_m": 740,
      "terrain": "trail vallonné (sentiers en pente, descentes techniques)",
      "race_date": "2026-09-06"
    },
    "total_weeks": 13,
    "sessions_per_week_range": "2 → 4",
    "start_date": "2026-06-02",
    "event_date": "2026-08-30",
    "athlete_profile": {
      "background": "pratiquant calisthénie (profil quadriceps marqué), reprise course",
      "starting_sessions_per_week": 2,
      "notes": "reprise volontairement douce pour éviter la blessure de reprise"
    },
    "principles": [
      "Ne jamais empiler le travail quadriceps",
      "Entraîner la descente (excentrique)"
    ],
    "generated_by": "seed-manuel (référence)",
    "source_docs": [
      "plan/plan_trail_descriptif.md",
      "plan/plan_trail_interactif.html",
      "docs/methodologie/03-hybride-trail-calisthenie.md"
    ],
    "notes": [
      "Programme de RÉFÉRENCE — reflète exactement backend/app/seed.py.",
      "Le circuit renfo est axé chaîne postérieure et descente pour rééquilibrer un profil calisthénie quadriceps.",
      "Renfo lourd des jambes uniquement le mardi, jamais collé à la sortie longue ou aux côtes."
    ]
  },
  "blocs": [
    { "key": "reprise", "name": "Reprise", "category": "Construction", "color": "#7ba05b", "color_key": "base", "description": "Phase de construction — montée progressive du volume, reprise en douceur.", "order": 1 },
    { "key": "base", "name": "Base", "category": "Construction", "color": "#7ba05b", "color_key": "base", "description": "Phase de construction — installation de la base d'endurance.", "order": 2 },
    { "key": "developpement", "name": "Développement", "category": "Construction", "color": "#7ba05b", "color_key": "base", "description": "Phase de construction — le volume grimpe.", "order": 3 },
    { "key": "allegee", "name": "Allégée", "category": "Récupération", "color": "#a99e88", "color_key": "allege", "description": "Récupération, assimilation de la charge. Ne pas la sauter.", "order": 4 },
    { "key": "pic", "name": "Pic de charge", "category": "Pic de charge", "color": "#c2562e", "color_key": "pic", "description": "Volume maximal, le bloc le plus exigeant.", "order": 5 },
    { "key": "simulateur", "name": "Simulateur", "category": "Simulateur", "color": "#c2562e", "color_key": "simul", "description": "Sortie choc qui reproduit le D+ de la course.", "order": 6 },
    { "key": "affutage", "name": "Affûtage", "category": "Affûtage", "color": "#6fa8c4", "color_key": "affut", "description": "Réduction du volume pour arriver frais.", "order": 7 }
  ],
  "weeks": [
    { "number": 1, "date_label": "1 juin", "bloc": "reprise", "long_run_label": "1h10 · ~11 km · 250 m D+", "long_run_duration_min": 70, "long_run_dplus_m": 250, "long_run_distance_km": 11, "sessions_per_week": 3, "sessions_label": null, "quality_session": "Lignes droites : 6×20 s rapides (RPE 9/10), récup : retour en marche", "focus": "Réveil en douceur. Endurance facile, on marche dès que ça monte raide.", "is_race": false },
    { "number": 2, "date_label": "8 juin", "bloc": "reprise", "long_run_label": "1h15 · ~12 km · 300 m D+", "long_run_duration_min": 75, "long_run_dplus_m": 300, "long_run_distance_km": 12, "sessions_per_week": 3, "sessions_label": null, "quality_session": "Côtes : 6×30 s allure course (RPE 8/10), récup : redescente en marche", "focus": "On installe la routine. Premières accélérations en côte, sans forcer.", "is_race": false },
    { "number": 3, "date_label": "15 juin", "bloc": "base", "long_run_label": "1h20 · ~13 km · 350 m D+", "long_run_duration_min": 80, "long_run_dplus_m": 350, "long_run_distance_km": 13, "sessions_per_week": 3, "sessions_label": "3 → 4", "quality_session": "Côtes : 6×1 min vif (RPE 8/10), récup : redescente en trot", "focus": "Passage vers 4 séances selon la forme. Le renfo du mardi devient régulier.", "is_race": false },
    { "number": 4, "date_label": "22 juin", "bloc": "allegee", "long_run_label": "1h00 · ~10 km · 250 m D+", "long_run_duration_min": 60, "long_run_dplus_m": 250, "long_run_distance_km": 10, "sessions_per_week": 3, "sessions_label": null, "quality_session": "Seuil doux : 2×6 min (RPE 6–7/10), récup 3 min trot", "focus": "Semaine de récup. Le corps assimile — ne la saute pas.", "is_race": false },
    { "number": 5, "date_label": "29 juin", "bloc": "base", "long_run_label": "1h30 · ~14 km · 400 m D+", "long_run_duration_min": 90, "long_run_dplus_m": 400, "long_run_distance_km": 14, "sessions_per_week": 4, "sessions_label": null, "quality_session": "Côtes : 8×1 min vif (RPE 8/10), récup : redescente en trot — 3 dernières descentes appuyées (RPE 6/10)", "focus": "On commence le travail de descente sur la longue. Sentiers en pente choisis exprès.", "is_race": false },
    { "number": 6, "date_label": "6 juil.", "bloc": "developpement", "long_run_label": "1h40 · ~15 km · 450 m D+", "long_run_duration_min": 100, "long_run_dplus_m": 450, "long_run_distance_km": 15, "sessions_per_week": 4, "sessions_label": null, "quality_session": "Seuil : 2×10 min (RPE 7/10), récup 3 min trot", "focus": "Le volume grimpe. Teste ta nutrition sur la longue.", "is_race": false },
    { "number": 7, "date_label": "13 juil.", "bloc": "developpement", "long_run_label": "1h50 · ~16 km · 500 m D+", "long_run_duration_min": 110, "long_run_dplus_m": 500, "long_run_distance_km": 16, "sessions_per_week": 4, "sessions_label": null, "quality_session": "Côtes : 10×1 min vif (RPE 8/10), récup : redescente en trot", "focus": "Première vraie longue. Power hiking dans les passages raides.", "is_race": false },
    { "number": 8, "date_label": "20 juil.", "bloc": "allegee", "long_run_label": "1h15 · ~12 km · 300 m D+", "long_run_duration_min": 75, "long_run_dplus_m": 300, "long_run_distance_km": 12, "sessions_per_week": 3, "sessions_label": null, "quality_session": "Seuil : 2×8 min (RPE 7/10), récup 3 min trot", "focus": "Deuxième coupure. Tu encaisses la charge avant le gros bloc.", "is_race": false },
    { "number": 9, "date_label": "27 juil.", "bloc": "pic", "long_run_label": "2h00 · ~17 km · 550 m D+", "long_run_duration_min": 120, "long_run_dplus_m": 550, "long_run_distance_km": 17, "sessions_per_week": 4, "sessions_label": null, "quality_session": "Côtes longues : 5×2 min soutenu (RPE 8/10), récup : redescente en trot", "focus": "Le bloc clé. Matériel testé en conditions réelles.", "is_race": false },
    { "number": 10, "date_label": "3 août", "bloc": "pic", "long_run_label": "2h15 · ~18 km · 600 m D+", "long_run_duration_min": 135, "long_run_dplus_m": 600, "long_run_distance_km": 18, "sessions_per_week": 4, "sessions_label": null, "quality_session": "Seuil : 3×10 min (RPE 7/10), récup 3 min trot", "focus": "Volume maximal. Gère la fatigue, dors bien.", "is_race": false },
    { "number": 11, "date_label": "10 août", "bloc": "simulateur", "long_run_label": "2h30 · ~15 km · ~700 m D+ (sortie choc)", "long_run_duration_min": 150, "long_run_dplus_m": 700, "long_run_distance_km": 15, "sessions_per_week": 4, "sessions_label": null, "quality_session": "Côtes : 6×2 min contrôlé (RPE 6–7/10), récup : redescente en trot", "focus": "Sortie choc à J-3 semaines : le D+ max que tu trouves. Évalue ton rythme en descente technique.", "is_race": false },
    { "number": 12, "date_label": "17 août", "bloc": "affutage", "long_run_label": "1h15 · ~12 km · 350 m D+", "long_run_duration_min": 75, "long_run_dplus_m": 350, "long_run_distance_km": 12, "sessions_per_week": 3, "sessions_label": null, "quality_session": "Côtes : 5×1 min vif (RPE 8/10), récup : redescente en trot", "focus": "Réduction ~50 % du volume. On garde du tonus, pas de fatigue.", "is_race": false },
    { "number": 13, "date_label": "24 août", "bloc": "affutage", "long_run_label": "45 min relâché + lignes → COURSE", "long_run_duration_min": 45, "long_run_dplus_m": 120, "long_run_distance_km": null, "sessions_per_week": 2, "sessions_label": null, "quality_session": "Repos, ou 20 min de footing très facile (RPE 3/10)", "focus": "Dernière ligne droite. Jambes fraîches, frais mental. La course t'attend.", "is_race": true }
  ],
  "exercises": [
    { "order": 1, "name": "Single-Leg RDL (soulevé roumain sur une jambe)", "volume": "3 × 10 / jambe", "target": "Chaîne postérieure", "rationale": "Cible ischios + fessiers : ce qui te propulse en montée et rééquilibre ton profil quadriceps." },
    { "order": 2, "name": "Step-downs lents", "volume": "3 × 8 / jambe", "target": "Descente", "rationale": "Descendre d'une marche/box en 4–5 s, contrôlé. LE geste de la descente : excentrique qui blinde les cuisses." },
    { "order": 3, "name": "Nordic Hamstring Curls", "volume": "3 × 6", "target": "Genou", "rationale": "Assistés au besoin. Protègent le genou au freinage, sécurisent la descente." },
    { "order": 4, "name": "Pont fessier sur une jambe", "volume": "3 × 12 / jambe", "target": "Fessiers", "rationale": "Renforce les fessiers sans recharger des quadriceps déjà bien sollicités ailleurs." },
    { "order": 5, "name": "Tibial raises + Calf raises (sur une marche)", "volume": "3 × 15", "target": "Cheville", "rationale": "Cheville solide = pas d'entorse au km 12 sur terrain instable." },
    { "order": 6, "name": "Planche latérale + levé de jambe", "volume": "3 × 40 s / côté", "target": "Gainage", "rationale": "Stabilité du bassin dans la foulée. Ton point fort calisthénie, à entretenir." }
  ]
}
